{
  "schemaVersion": 1,
  "recordType": "external-beta-host-session",
  "status": "NOT_RUN",
  "recordId": "host-macos-reaper-clap-candidate-0001",
  "targetId": "HOST-001",
  "platform": "macos",
  "architecture": "arm64",
  "host": "reaper",
  "hostVersion": "",
  "hostBuild": "",
  "pluginFormat": "CLAP",
  "osBuild": "",
  "candidateRootId": "",
  "pluginSha256": "",
  "installedTreeSha256": "",
  "artifactPath": "",
  "bankIdentity": {"id": "beta.voice.01", "version": "", "contentSha256": "", "installedProvenanceTreeSha256": ""},
  "projectIdentity": {"projectSha256": "", "mediaSha256": ""},
  "workloadId": "eb.host.session.v1",
  "workloadSha256": "",
  "machineProfileId": "eb.macos.arm64.reference.v1",
  "machineProfileSha256": "",
  "clockAuthority": "physical-device-clock",
  "operator": "",
  "verifier": "",
  "startedAt": "",
  "endedAt": "",
  "checks": {},
  "evidence": []
}
